[{"DOI": "10.48550/arXiv.1906.11583", "URL": "http://arxiv.org/abs/1906.11583", "abstract": "Scienti\ufb01c models describe natural phenomena at different levels of abstraction. Abstract descriptions can provide the basis for interventions on the system and explanation of observed phenomena at a level of granularity that is coarser than the most fundamental account of the system. Beckers and Halpern (2019), building on work of Rubenstein et al. (2017), developed an account of abstraction for causal models that is exact. Here we extend this account to the more realistic case where an abstract causal model offers only an approximation of the underlying system. We show how the resulting account handles the discrepancy that can arise between low- and highlevel causal models of the same system, and in the process provide an account of how one causal model approximates another, a topic of independent interest. Finally, we extend the account of approximate abstractions to probabilistic causal models, indicating how and where uncertainty can enter into an approximate abstraction.", "accessed": {"date-parts": [[2021, 4, 4]]}, "author": [{"family": "Beckers", "given": "Sander"}, {"family": "Eberhardt", "given": "Frederick"}, {"family": "Halpern", "given": "Joseph Y."}], "container-title": "arXiv:1906.11583 [cs]", "id": "beckers_approximate_2019", "issued": {"date-parts": [[2019, 6, 29]]}, "keyword": "Computer Science - Artificial Intelligence", "language": "en-US", "title": "Approximate causal abstraction", "type": "article-journal", "original_bibtex": "@article{beckers_approximate_2019,\n abstract = {Scienti\ufb01c models describe natural phenomena at different levels of abstraction. Abstract descriptions can provide the basis for interventions on the system and explanation of observed phenomena at a level of granularity that is coarser than the most fundamental account of the system. Beckers and Halpern (2019), building on work of Rubenstein et al. (2017), developed an account of abstraction for causal models that is exact. Here we extend this account to the more realistic case where an abstract causal model offers only an approximation of the underlying system. We show how the resulting account handles the discrepancy that can arise between low- and highlevel causal models of the same system, and in the process provide an account of how one causal model approximates another, a topic of independent interest. Finally, we extend the account of approximate abstractions to probabilistic causal models, indicating how and where uncertainty can enter into an approximate abstraction.},\n author = {Beckers, Sander and Eberhardt, Frederick and Halpern, Joseph Y.},\n date = {2019-06-29},\n doi = {10.48550/arXiv.1906.11583},\n eprint = {1906.11583},\n eprinttype = {arxiv},\n file = {Full Text:/home/eigil/Zotero/storage/WIY34UXR/Beckers et al. - 2019 - Approximate Causal Abstraction.pdf:application/pdf},\n journaltitle = {{arXiv}:1906.11583 [cs]},\n keywords = {Computer Science - Artificial Intelligence},\n langid = {english},\n title = {Approximate Causal Abstraction},\n url = {http://arxiv.org/abs/1906.11583},\n urldate = {2021-04-04}\n}\n"}]