[{"DOI": "10.48550/arXiv.1412.2309", "abstract": "We provide a rigorous de\ufb01nition of the visual cause of a behavior that is broadly applicable to the visually driven behavior in humans, animals, neurons, robots and other perceiving systems. Our framework generalizes standard accounts of causal learning to settings in which the causal variables need to be constructed from micro-variables. We prove the Causal Coarsening Theorem, which allows us to gain causal knowledge from observational data with minimal experimental effort. The theorem provides a connection to standard inference techniques in machine learning that identify features of an image that correlate with, but may not cause, the target behavior. Finally, we propose an active learning scheme to learn a manipulator function that performs optimal manipulations on the image to automatically identify the visual cause of a target behavior. We illustrate our inference and learning algorithms in experiments based on both synthetic and real data.", "author": [{"family": "Chalupka", "given": "Krzysztof"}, {"family": "Perona", "given": "Pietro"}, {"family": "Eberhardt", "given": "Frederick"}], "id": "chalupka_visual_2015", "issued": {"date-parts": [[2015, 6, 4]]}, "language": "en-US", "page": "10", "title": "Visual causal feature learning", "type": "article-journal", "original_bibtex": "@article{chalupka_visual_2015,\n abstract = {We provide a rigorous de\ufb01nition of the visual cause of a behavior that is broadly applicable to the visually driven behavior in humans, animals, neurons, robots and other perceiving systems. Our framework generalizes standard accounts of causal learning to settings in which the causal variables need to be constructed from micro-variables. We prove the Causal Coarsening Theorem, which allows us to gain causal knowledge from observational data with minimal experimental effort. The theorem provides a connection to standard inference techniques in machine learning that identify features of an image that correlate with, but may not cause, the target behavior. Finally, we propose an active learning scheme to learn a manipulator function that performs optimal manipulations on the image to automatically identify the visual cause of a target behavior. We illustrate our inference and learning algorithms in experiments based on both synthetic and real data.},\n author = {Chalupka, Krzysztof and Perona, Pietro and Eberhardt, Frederick},\n date = {2015-06-04},\n doi = {10.48550/arXiv.1412.2309},\n file = {msc109.pdf:/home/eigil/Dropbox/Matematik/Tekster/msc109.pdf:application/pdf},\n langid = {english},\n pages = {10},\n title = {Visual Causal Feature Learning}\n}\n"}]