[{"DOI": "10.1007/3-540-45657-0_11", "ISBN": "978-3-540-43997-4 978-3-540-45657-5", "URL": "http://link.springer.com/10.1007/3-540-45657-0_11", "abstract": "Generalized model checking is a framework for reasoning about partial state spaces of concurrent reactive systems. The state space of a system is only \\partial\" (partially known) when a full state-space exploration is not computationally tractable, or when abstraction techniques are used to simplify the system\u2019s representation. In the context of automatic abstraction, generalized model checking means checking whether there exists a concretization of an abstraction that satis es a temporal logic formula. In this paper, we show how generalized model checking can extend existing automatic abstraction techniques (such as predicate abstraction) for model checking concurrent/reactive programs and yield the three following improvements: (1) any temporal logic formula can be checked (not just universal properties as with traditional conservative abstractions), (2) correctness proofs and counter-examples are both guaranteed to be sound, and (3) veri cation results can be more precise. We study the cost needed to improve precision by presenting new upper and lower bounds for the complexity of generalized model checking in the size of the abstraction.", "accessed": {"date-parts": [[2024, 3, 31]]}, "author": [{"family": "Godefroid", "given": "Patrice"}, {"family": "Jagadeesan", "given": "Radha"}], "container-title": "Computer aided verification", "editor": [{"family": "Brinksma", "given": "Ed"}, {"family": "Larsen", "given": "Kim Guldstrand"}], "id": "goos_automatic_2002", "issued": {"date-parts": [[2002]]}, "language": "en-US", "note": "Series Title: Lecture Notes in Computer Science", "page": "137-151", "publisher": "Springer Berlin Heidelberg", "publisher-place": "Berlin, Heidelberg", "title": "Automatic abstraction using generalized model checking", "type": "chapter", "volume": "2404", "original_bibtex": "@incollection{goos_automatic_2002,\n abstract = {Generalized model checking is a framework for reasoning about partial state spaces of concurrent reactive systems. The state space of a system is only {\\textbackslash}partial\" (partially known) when a full state-space exploration is not computationally tractable, or when abstraction techniques are used to simplify the system's representation. In the context of automatic abstraction, generalized model checking means checking whether there exists a concretization of an abstraction that satis es a temporal logic formula. In this paper, we show how generalized model checking can extend existing automatic abstraction techniques (such as predicate abstraction) for model checking concurrent/reactive programs and yield the three following improvements: (1) any temporal logic formula can be checked (not just universal properties as with traditional conservative abstractions), (2) correctness proofs and counter-examples are both guaranteed to be sound, and (3) veri cation results can be more precise. We study the cost needed to improve precision by presenting new upper and lower bounds for the complexity of generalized model checking in the size of the abstraction.},\n author = {Godefroid, Patrice and Jagadeesan, Radha},\n booktitle = {Computer Aided Verification},\n date = {2002},\n doi = {10.1007/3-540-45657-0_11},\n editor = {Brinksma, Ed and Larsen, Kim Guldstrand},\n editorb = {Goos, Gerhard and Hartmanis, Juris and Van Leeuwen, Jan},\n editorbtype = {redactor},\n file = {Godefroid and Jagadeesan - 2002 - Automatic Abstraction Using Generalized Model Chec.pdf:/home/eigil/Zotero/storage/E9PFXZKQ/Godefroid and Jagadeesan - 2002 - Automatic Abstraction Using Generalized Model Chec.pdf:application/pdf},\n isbn = {978-3-540-43997-4 978-3-540-45657-5},\n langid = {english},\n location = {Berlin, Heidelberg},\n note = {Series Title: Lecture Notes in Computer Science},\n pages = {137--151},\n publisher = {Springer Berlin Heidelberg},\n title = {Automatic Abstraction Using Generalized Model Checking},\n url = {http://link.springer.com/10.1007/3-540-45657-0_11},\n urldate = {2024-03-31},\n volume = {2404}\n}\n"}]